{
  "$schema": "https://json-schema.org/draft/2020-12/schema",
  "title": "DailyEntry",
  "type": "object",
  "required": ["date", "market", "status"],
  "properties": {
    "date": { "type": "string", "pattern": "^\\d{4}-\\d{2}-\\d{2}$" },
    "market": { "enum": ["KR", "US"] },
    "status": { "enum": ["pick", "no_pick"] },
    "stock": {
      "type": "object",
      "required": ["symbol", "name", "exchange", "currency"],
      "properties": {
        "symbol": { "type": "string" },
        "name": { "$ref": "#/$defs/localizedText" },
        "exchange": { "type": "string" },
        "currency": { "enum": ["KRW", "USD"] },
        "profile": {
          "type": "object",
          "required": ["overview"],
          "properties": {
            "overview": { "$ref": "#/$defs/localizedText" },
            "sector": { "$ref": "#/$defs/localizedText" },
            "industry": { "$ref": "#/$defs/localizedText" }
          }
        }
      }
    },
    "scores": {
      "type": "object",
      "required": ["composite", "growth", "valuation", "momentum", "quality", "threshold"],
      "properties": {
        "composite": { "type": "number" },
        "size": { "type": "number" },
        "growth": { "type": "number" },
        "valuation": { "type": "number" },
        "entry": { "type": "number" },
        "momentum": { "type": "number" },
        "quality": { "type": "number" },
        "threshold": { "type": "number" },
        "version": { "type": "integer", "minimum": 1 }
      }
    },
    "reasoning": {
      "type": "object",
      "properties": {
        "summary": { "$ref": "#/$defs/localizedText" },
        "size": { "$ref": "#/$defs/localizedText" },
        "growth": { "$ref": "#/$defs/localizedText" },
        "valuation": { "$ref": "#/$defs/localizedText" },
        "entry": { "$ref": "#/$defs/localizedText" },
        "momentum": { "$ref": "#/$defs/localizedText" },
        "quality": { "$ref": "#/$defs/localizedText" },
        "risks": {
          "type": "array",
          "items": { "$ref": "#/$defs/localizedText" }
        }
      }
    },
    "meta": {
      "type": "object",
      "required": ["generatedAt", "candidatesScreened", "excludedRecent"],
      "properties": {
        "generatedAt": { "type": "string" },
        "candidatesScreened": { "type": "integer", "minimum": 0 },
        "excludedRecent": { "type": "integer", "minimum": 0 },
        "skippedMarketCap": { "type": "integer", "minimum": 0 },
        "skippedRedFlags": { "type": "integer", "minimum": 0 },
        "noData": { "type": "integer", "minimum": 0 },
        "errors": { "type": "integer", "minimum": 0 }
      }
    },
    "topCandidates": {
      "type": "array",
      "items": { "$ref": "#/$defs/topNCandidate" },
      "description": "Optional Top-N (max 5 enforced in validate_content semantic checks)"
    }
  },
  "allOf": [
    {
      "if": { "properties": { "status": { "const": "pick" } } },
      "then": { "required": ["stock", "scores", "reasoning", "meta"] }
    },
    {
      "if": { "properties": { "status": { "const": "no_pick" } } },
      "then": { "required": ["scores", "meta"] }
    }
  ],
  "$defs": {
    "localizedText": {
      "title": "LocalizedText",
      "type": "object",
      "required": ["ko", "en"],
      "additionalProperties": false,
      "properties": {
        "ko": { "type": "string" },
        "en": { "type": "string" }
      }
    },
    "topNScores": {
      "title": "TopNScores",
      "type": "object",
      "required": [
        "composite",
        "size",
        "growth",
        "valuation",
        "entry",
        "momentum",
        "quality"
      ],
      "additionalProperties": false,
      "properties": {
        "composite": { "type": "number" },
        "size": { "type": "number" },
        "growth": { "type": "number" },
        "valuation": { "type": "number" },
        "entry": { "type": "number" },
        "momentum": { "type": "number" },
        "quality": { "type": "number" },
        "version": { "type": "integer", "minimum": 1 }
      }
    },
    "topNCandidate": {
      "title": "TopNCandidate",
      "type": "object",
      "required": ["rank", "symbol", "name", "exchange", "currency", "scores"],
      "additionalProperties": false,
      "properties": {
        "rank": { "type": "integer", "minimum": 1, "maximum": 5 },
        "symbol": { "type": "string", "minLength": 1 },
        "name": { "$ref": "#/$defs/localizedText" },
        "exchange": { "type": "string" },
        "currency": { "enum": ["KRW", "USD"] },
        "scores": { "$ref": "#/$defs/topNScores" },
        "riskTag": { "$ref": "#/$defs/riskTag" },
        "riskText": { "$ref": "#/$defs/localizedText" },
        "riskClassification": { "$ref": "#/$defs/riskClassification" },
        "moatWidth": { "$ref": "#/$defs/moatWidth" },
        "moatText": { "$ref": "#/$defs/localizedText" },
        "moatClassification": { "$ref": "#/$defs/moatClassification" },
        "megatrendTheme": { "$ref": "#/$defs/megatrendTheme" },
        "megatrendText": { "$ref": "#/$defs/localizedText" },
        "megatrendClassification": { "$ref": "#/$defs/megatrendClassification" }
      }
    },
    "moatWidth": {
      "title": "MoatWidth",
      "type": "string",
      "enum": ["none", "narrow", "wide"]
    },
    "megatrendTheme": {
      "title": "MegatrendTheme",
      "type": "string",
      "enum": ["none", "ai_infrastructure", "power_grid", "robotics"]
    },
    "moatClassification": {
      "title": "MoatClassification",
      "type": "object",
      "required": ["model", "sdkVersion", "inputAt", "fallback"],
      "additionalProperties": false,
      "properties": {
        "model": { "type": "string" },
        "sdkVersion": { "type": "string" },
        "inputAt": { "type": "string" },
        "tag": { "$ref": "#/$defs/moatWidth" },
        "fallback": { "type": "boolean" },
        "fallbackReason": { "type": "string" }
      }
    },
    "megatrendClassification": {
      "title": "MegatrendClassification",
      "type": "object",
      "required": ["model", "sdkVersion", "inputAt", "fallback"],
      "additionalProperties": false,
      "properties": {
        "model": { "type": "string" },
        "sdkVersion": { "type": "string" },
        "inputAt": { "type": "string" },
        "tag": { "$ref": "#/$defs/megatrendTheme" },
        "fallback": { "type": "boolean" },
        "fallbackReason": { "type": "string" }
      }
    },
    "riskTag": {
      "title": "RiskTag",
      "type": "string",
      "enum": [
        "customer_concentration",
        "regulation",
        "single_product_pipeline",
        "technology_obsolescence",
        "commodities_fx",
        "debt_liquidity",
        "holding_complexity",
        "insufficient_evidence"
      ]
    },
    "riskClassification": {
      "title": "RiskClassification",
      "type": "object",
      "required": ["model", "sdkVersion", "inputAt", "fallback"],
      "additionalProperties": false,
      "properties": {
        "model": { "type": "string" },
        "sdkVersion": { "type": "string" },
        "inputAt": { "type": "string" },
        "tag": { "$ref": "#/$defs/riskTag" },
        "fallback": { "type": "boolean" },
        "fallbackReason": { "type": "string" }
      }
    }
  }
}
