{
  "date": "2026-10-17",
  "market": "KR",
  "status": "pick",
  "stock": {
    "symbol": "178920.KS",
    "name": {
      "ko": "PI첨단소재",
      "en": "PI Advanced Materials Co., Ltd."
    },
    "exchange": "KOSPI",
    "currency": "KRW",
    "profile": {
      "overview": {
        "ko": "PI첨단소재는 Basic Materials 분야 Specialty Chemicals 기업입니다.",
        "en": "PI Advanced Materials Co., Ltd. engages in the manufacture and sale of polyimide-based materials in South Korea. It offers PI film, and PI varnish and power/mold products for use in IT, electric vehicles, display, semiconductor, and advance industrials."
      },
      "sector": {
        "ko": "Basic Materials",
        "en": "Basic Materials"
      },
      "industry": {
        "ko": "Specialty Chemicals",
        "en": "Specialty Chemicals"
      }
    }
  },
  "scores": {
    "composite": 76.7,
    "size": 100.0,
    "growth": 95.9,
    "valuation": 73.5,
    "entry": 59.0,
    "momentum": 45.6,
    "quality": 68.3,
    "threshold": 70.0,
    "version": 2
  },
  "reasoning": {
    "summary": {
      "ko": "PI첨단소재(178920.KS)는 v2 복합 점수 76.7로 임계 70.0를 상회했습니다. 소형·가치·현금·진입 타이밍이 균형을 이룹니다.",
      "en": "PI Advanced Materials Co., Ltd. (178920.KS) cleared the 70.0 threshold with v2 composite 76.7; size, value, cash, and entry align."
    },
    "growth": {
      "ko": "매출 6.9% / 이익 49.2% (혼합 25.94%) — 지속 가능 성장 점수 95.9.",
      "en": "Revenue 6.9% / earnings 49.2% (blended 25.94%) — sustainable growth score 95.9."
    },
    "valuation": {
      "ko": "PER 9.1, PEG 데이터 없음, FCF수익률 11.72%, PBR 데이터 없음 — 밸류 점수 73.5.",
      "en": "P/E 9.1, PEG No data, FCF yield 11.72%, P/B No data — valuation score 73.5."
    },
    "momentum": {
      "ko": "6개월 수익률 -23.45% — 보조 모멘텀 점수 45.6.",
      "en": "6M return -23.45% — auxiliary momentum score 45.6."
    },
    "quality": {
      "ko": "ROE 11.41%, ROA 6.94%, FCF/순이익 1.5 — 품질 점수 68.3.",
      "en": "ROE 11.41%, ROA 6.94%, FCF/net income 1.5 — quality score 68.3."
    },
    "risks": [
      {
        "ko": "실적 가이던스 하향 시 성장 프리미엄 축소 가능",
        "en": "Growth premium may compress on guidance cuts"
      },
      {
        "ko": "글로벌 금리·유동성 변화에 따른 밸류에이션 리레이팅",
        "en": "Valuation re-rating risk from rates and liquidity"
      },
      {
        "ko": "5년 10배는 목표 시나리오이며 달성을 보장하지 않음",
        "en": "10x in five years is a scenario, not a guarantee"
      }
    ],
    "size": {
      "ko": "시가총액 521545875456 기준 규모 점수 100.0.",
      "en": "Market cap 521545875456 — size score 100.0."
    },
    "entry": {
      "ko": "12개월 가격대 18.47%, 52주 고점 대비 -43.17% — 진입 점수 59.0.",
      "en": "12M price range 18.47%, -43.17% from 52W high — entry score 59.0."
    }
  },
  "meta": {
    "generatedAt": "2026-10-17T08:34:53+09:00",
    "candidatesScreened": 1889,
    "excludedRecent": 29,
    "skippedMarketCap": 858,
    "skippedRedFlags": 364,
    "noData": 4,
    "errors": 1
  },
  "topCandidates": [
    {
      "rank": 1,
      "symbol": "178920.KS",
      "name": {
        "ko": "PI첨단소재",
        "en": "PI Advanced Materials Co., Ltd."
      },
      "exchange": "KOSPI",
      "currency": "KRW",
      "scores": {
        "composite": 76.7,
        "size": 100.0,
        "growth": 95.9,
        "valuation": 73.5,
        "entry": 59.0,
        "momentum": 45.6,
        "quality": 68.3,
        "version": 2
      },
      "riskClassification": {
        "model": "jev-1.13.0",
        "sdkVersion": "0.7.2",
        "inputAt": "2026-10-16T23:34:53+00:00",
        "fallback": true,
        "fallbackReason": "missing_api_key"
      },
      "moatClassification": {
        "model": "jev-1.13.0",
        "sdkVersion": "0.7.2",
        "inputAt": "2026-10-16T23:34:53+00:00",
        "fallback": true,
        "fallbackReason": "missing_api_key"
      },
      "megatrendClassification": {
        "model": "jev-1.13.0",
        "sdkVersion": "0.7.2",
        "inputAt": "2026-10-16T23:34:53+00:00",
        "fallback": true,
        "fallbackReason": "missing_api_key"
      }
    },
    {
      "rank": 2,
      "symbol": "065710.KQ",
      "name": {
        "ko": "서호전기",
        "en": "Seoho Electric Co.,Ltd"
      },
      "exchange": "KOSDAQ",
      "currency": "KRW",
      "scores": {
        "composite": 76.4,
        "size": 100.0,
        "growth": 85.0,
        "valuation": 65.8,
        "entry": 75.0,
        "momentum": 60.4,
        "quality": 72.3,
        "version": 2
      },
      "riskClassification": {
        "model": "jev-1.13.0",
        "sdkVersion": "0.7.2",
        "inputAt": "2026-10-16T23:34:53+00:00",
        "fallback": true,
        "fallbackReason": "missing_api_key"
      },
      "moatClassification": {
        "model": "jev-1.13.0",
        "sdkVersion": "0.7.2",
        "inputAt": "2026-10-16T23:34:53+00:00",
        "fallback": true,
        "fallbackReason": "missing_api_key"
      },
      "megatrendClassification": {
        "model": "jev-1.13.0",
        "sdkVersion": "0.7.2",
        "inputAt": "2026-10-16T23:34:53+00:00",
        "fallback": true,
        "fallbackReason": "missing_api_key"
      }
    },
    {
      "rank": 3,
      "symbol": "069260.KS",
      "name": {
        "ko": "TKG휴켐스",
        "en": "TKG Huchems Co., Ltd."
      },
      "exchange": "KOSPI",
      "currency": "KRW",
      "scores": {
        "composite": 75.9,
        "size": 100.0,
        "growth": 99.3,
        "valuation": 73.5,
        "entry": 68.0,
        "momentum": 51.3,
        "quality": 53.5,
        "version": 2
      },
      "riskClassification": {
        "model": "jev-1.13.0",
        "sdkVersion": "0.7.2",
        "inputAt": "2026-10-16T23:34:53+00:00",
        "fallback": true,
        "fallbackReason": "missing_api_key"
      },
      "moatClassification": {
        "model": "jev-1.13.0",
        "sdkVersion": "0.7.2",
        "inputAt": "2026-10-16T23:34:53+00:00",
        "fallback": true,
        "fallbackReason": "missing_api_key"
      },
      "megatrendClassification": {
        "model": "jev-1.13.0",
        "sdkVersion": "0.7.2",
        "inputAt": "2026-10-16T23:34:53+00:00",
        "fallback": true,
        "fallbackReason": "missing_api_key"
      }
    },
    {
      "rank": 4,
      "symbol": "040420.KQ",
      "name": {
        "ko": "정상제이엘에스",
        "en": "JLS Co.,Ltd."
      },
      "exchange": "KOSDAQ",
      "currency": "KRW",
      "scores": {
        "composite": 75.8,
        "size": 100.0,
        "growth": 95.1,
        "valuation": 73.5,
        "entry": 64.5,
        "momentum": 56.7,
        "quality": 56.5,
        "version": 2
      },
      "riskClassification": {
        "model": "jev-1.13.0",
        "sdkVersion": "0.7.2",
        "inputAt": "2026-10-16T23:34:53+00:00",
        "fallback": true,
        "fallbackReason": "missing_api_key"
      },
      "moatClassification": {
        "model": "jev-1.13.0",
        "sdkVersion": "0.7.2",
        "inputAt": "2026-10-16T23:34:53+00:00",
        "fallback": true,
        "fallbackReason": "missing_api_key"
      },
      "megatrendClassification": {
        "model": "jev-1.13.0",
        "sdkVersion": "0.7.2",
        "inputAt": "2026-10-16T23:34:53+00:00",
        "fallback": true,
        "fallbackReason": "missing_api_key"
      }
    },
    {
      "rank": 5,
      "symbol": "950190.KQ",
      "name": {
        "ko": "고스트스튜디오",
        "en": "Ghost Studio Co., Ltd."
      },
      "exchange": "KOSDAQ",
      "currency": "KRW",
      "scores": {
        "composite": 75.3,
        "size": 100.0,
        "growth": 96.5,
        "valuation": 65.8,
        "entry": 57.5,
        "momentum": 69.5,
        "quality": 59.4,
        "version": 2
      },
      "riskClassification": {
        "model": "jev-1.13.0",
        "sdkVersion": "0.7.2",
        "inputAt": "2026-10-16T23:34:53+00:00",
        "fallback": true,
        "fallbackReason": "missing_api_key"
      },
      "moatClassification": {
        "model": "jev-1.13.0",
        "sdkVersion": "0.7.2",
        "inputAt": "2026-10-16T23:34:53+00:00",
        "fallback": true,
        "fallbackReason": "missing_api_key"
      },
      "megatrendClassification": {
        "model": "jev-1.13.0",
        "sdkVersion": "0.7.2",
        "inputAt": "2026-10-16T23:34:53+00:00",
        "fallback": true,
        "fallbackReason": "missing_api_key"
      }
    }
  ]
}
