{
  "date": "2026-10-27",
  "market": "KR",
  "status": "pick",
  "stock": {
    "symbol": "439260.KS",
    "name": {
      "ko": "대한조선",
      "en": "Daehan Shipbuilding Co., Ltd."
    },
    "exchange": "KOSPI",
    "currency": "KRW",
    "profile": {
      "overview": {
        "ko": "대한조선는 Industrials 분야 Aerospace & Defense 기업입니다.",
        "en": "Daehan Shipbuilding Co., Ltd. provides ship construction and repair services. It develops crude oil tankers, product carriers, shuttle tankers, container carriers, and bulk carriers."
      },
      "sector": {
        "ko": "Industrials",
        "en": "Industrials"
      },
      "industry": {
        "ko": "Aerospace & Defense",
        "en": "Aerospace & Defense"
      }
    }
  },
  "scores": {
    "composite": 78.2,
    "size": 92.0,
    "growth": 99.2,
    "valuation": 73.5,
    "entry": 59.0,
    "momentum": 35.0,
    "quality": 83.9,
    "threshold": 70.0,
    "version": 2
  },
  "reasoning": {
    "summary": {
      "ko": "대한조선(439260.KS)는 v2 복합 점수 78.2로 임계 70.0를 상회했습니다. 소형·가치·현금·진입 타이밍이 균형을 이룹니다.",
      "en": "Daehan Shipbuilding Co., Ltd. (439260.KS) cleared the 70.0 threshold with v2 composite 78.2; size, value, cash, and entry align."
    },
    "growth": {
      "ko": "매출 19.7% / 이익 44.4% (혼합 30.82%) — 지속 가능 성장 점수 99.2.",
      "en": "Revenue 19.7% / earnings 44.4% (blended 30.82%) — sustainable growth score 99.2."
    },
    "valuation": {
      "ko": "PER 4.73, PEG 데이터 없음, FCF수익률 14.29%, PBR 데이터 없음 — 밸류 점수 73.5.",
      "en": "P/E 4.73, PEG No data, FCF yield 14.29%, P/B No data — valuation score 73.5."
    },
    "momentum": {
      "ko": "6개월 수익률 -59.0% — 보조 모멘텀 점수 35.0.",
      "en": "6M return -59.0% — auxiliary momentum score 35.0."
    },
    "quality": {
      "ko": "ROE 34.23%, ROA 14.27%, FCF/순이익 0.67 — 품질 점수 83.9.",
      "en": "ROE 34.23%, ROA 14.27%, FCF/net income 0.67 — quality score 83.9."
    },
    "risks": [
      {
        "ko": "실적 가이던스 하향 시 성장 프리미엄 축소 가능",
        "en": "Growth premium may compress on guidance cuts"
      },
      {
        "ko": "글로벌 금리·유동성 변화에 따른 밸류에이션 리레이팅",
        "en": "Valuation re-rating risk from rates and liquidity"
      },
      {
        "ko": "5년 10배는 목표 시나리오이며 달성을 보장하지 않음",
        "en": "10x in five years is a scenario, not a guarantee"
      }
    ],
    "size": {
      "ko": "시가총액 1405474045952 기준 규모 점수 92.0.",
      "en": "Market cap 1405474045952 — size score 92.0."
    },
    "entry": {
      "ko": "12개월 가격대 0.85%, 52주 고점 대비 -65.42% — 진입 점수 59.0.",
      "en": "12M price range 0.85%, -65.42% from 52W high — entry score 59.0."
    }
  },
  "meta": {
    "generatedAt": "2026-10-27T09:51:26+09:00",
    "candidatesScreened": 2751,
    "excludedRecent": 26,
    "skippedMarketCap": 0,
    "skippedRedFlags": 583,
    "noData": 5,
    "errors": 1
  },
  "topCandidates": [
    {
      "rank": 1,
      "symbol": "439260.KS",
      "name": {
        "ko": "대한조선",
        "en": "Daehan Shipbuilding Co., Ltd."
      },
      "exchange": "KOSPI",
      "currency": "KRW",
      "scores": {
        "composite": 78.2,
        "size": 92.0,
        "growth": 99.2,
        "valuation": 73.5,
        "entry": 59.0,
        "momentum": 35.0,
        "quality": 83.9,
        "version": 2
      },
      "riskClassification": {
        "model": "jev-1.13.0",
        "sdkVersion": "0.7.5",
        "inputAt": "2026-10-27T00:51:26+00:00",
        "fallback": true,
        "fallbackReason": "missing_api_key"
      },
      "moatClassification": {
        "model": "jev-1.13.0",
        "sdkVersion": "0.7.5",
        "inputAt": "2026-10-27T00:51:26+00:00",
        "fallback": true,
        "fallbackReason": "missing_api_key"
      },
      "megatrendClassification": {
        "model": "jev-1.13.0",
        "sdkVersion": "0.7.5",
        "inputAt": "2026-10-27T00:51:26+00:00",
        "fallback": true,
        "fallbackReason": "missing_api_key"
      }
    },
    {
      "rank": 2,
      "symbol": "100030.KQ",
      "name": {
        "ko": "인지소프트",
        "en": "Inzisoft Co.,Ltd."
      },
      "exchange": "KOSDAQ",
      "currency": "KRW",
      "scores": {
        "composite": 77.3,
        "size": 100.0,
        "growth": 85.0,
        "valuation": 57.0,
        "entry": 75.0,
        "momentum": 57.8,
        "quality": 88.9,
        "version": 2
      },
      "riskClassification": {
        "model": "jev-1.13.0",
        "sdkVersion": "0.7.5",
        "inputAt": "2026-10-27T00:51:26+00:00",
        "fallback": true,
        "fallbackReason": "missing_api_key"
      },
      "moatClassification": {
        "model": "jev-1.13.0",
        "sdkVersion": "0.7.5",
        "inputAt": "2026-10-27T00:51:26+00:00",
        "fallback": true,
        "fallbackReason": "missing_api_key"
      },
      "megatrendClassification": {
        "model": "jev-1.13.0",
        "sdkVersion": "0.7.5",
        "inputAt": "2026-10-27T00:51:26+00:00",
        "fallback": true,
        "fallbackReason": "missing_api_key"
      }
    },
    {
      "rank": 3,
      "symbol": "040420.KQ",
      "name": {
        "ko": "정상제이엘에스",
        "en": "JLS Co.,Ltd."
      },
      "exchange": "KOSDAQ",
      "currency": "KRW",
      "scores": {
        "composite": 76.0,
        "size": 100.0,
        "growth": 95.1,
        "valuation": 73.5,
        "entry": 68.0,
        "momentum": 55.0,
        "quality": 56.5,
        "version": 2
      },
      "riskClassification": {
        "model": "jev-1.13.0",
        "sdkVersion": "0.7.5",
        "inputAt": "2026-10-27T00:51:26+00:00",
        "fallback": true,
        "fallbackReason": "missing_api_key"
      },
      "moatClassification": {
        "model": "jev-1.13.0",
        "sdkVersion": "0.7.5",
        "inputAt": "2026-10-27T00:51:26+00:00",
        "fallback": true,
        "fallbackReason": "missing_api_key"
      },
      "megatrendClassification": {
        "model": "jev-1.13.0",
        "sdkVersion": "0.7.5",
        "inputAt": "2026-10-27T00:51:26+00:00",
        "fallback": true,
        "fallbackReason": "missing_api_key"
      }
    },
    {
      "rank": 4,
      "symbol": "090080.KS",
      "name": {
        "ko": "평화산업",
        "en": "Pyung Hwa Industrial Co., Ltd."
      },
      "exchange": "KOSPI",
      "currency": "KRW",
      "scores": {
        "composite": 75.7,
        "size": 100.0,
        "growth": 82.8,
        "valuation": 65.8,
        "entry": 75.0,
        "momentum": 51.9,
        "quality": 74.9,
        "version": 2
      },
      "riskClassification": {
        "model": "jev-1.13.0",
        "sdkVersion": "0.7.5",
        "inputAt": "2026-10-27T00:51:26+00:00",
        "fallback": true,
        "fallbackReason": "missing_api_key"
      },
      "moatClassification": {
        "model": "jev-1.13.0",
        "sdkVersion": "0.7.5",
        "inputAt": "2026-10-27T00:51:26+00:00",
        "fallback": true,
        "fallbackReason": "missing_api_key"
      },
      "megatrendClassification": {
        "model": "jev-1.13.0",
        "sdkVersion": "0.7.5",
        "inputAt": "2026-10-27T00:51:26+00:00",
        "fallback": true,
        "fallbackReason": "missing_api_key"
      }
    },
    {
      "rank": 5,
      "symbol": "066620.KQ",
      "name": {
        "ko": "국보디자인",
        "en": "Kukbo Design Co., Ltd."
      },
      "exchange": "KOSDAQ",
      "currency": "KRW",
      "scores": {
        "composite": 75.5,
        "size": 100.0,
        "growth": 85.0,
        "valuation": 65.8,
        "entry": 75.0,
        "momentum": 57.8,
        "quality": 68.9,
        "version": 2
      },
      "riskClassification": {
        "model": "jev-1.13.0",
        "sdkVersion": "0.7.5",
        "inputAt": "2026-10-27T00:51:26+00:00",
        "fallback": true,
        "fallbackReason": "missing_api_key"
      },
      "moatClassification": {
        "model": "jev-1.13.0",
        "sdkVersion": "0.7.5",
        "inputAt": "2026-10-27T00:51:26+00:00",
        "fallback": true,
        "fallbackReason": "missing_api_key"
      },
      "megatrendClassification": {
        "model": "jev-1.13.0",
        "sdkVersion": "0.7.5",
        "inputAt": "2026-10-27T00:51:26+00:00",
        "fallback": true,
        "fallbackReason": "missing_api_key"
      }
    }
  ]
}
