{
  "date": "2026-09-08",
  "market": "US",
  "status": "pick",
  "stock": {
    "symbol": "EVER",
    "name": {
      "ko": "EverQuote  Inc.",
      "en": "EverQuote, Inc."
    },
    "exchange": "NASDAQ",
    "currency": "USD",
    "profile": {
      "overview": {
        "ko": "EverQuote  Inc.는 Communication Services 분야 Internet Content & Information 기업입니다.",
        "en": "EverQuote, Inc. operates an online marketplace for insurance shopping in the United States. The company provides automotive, and home and renters insurance, as well as campaign management tools."
      },
      "sector": {
        "ko": "Communication Services",
        "en": "Communication Services"
      },
      "industry": {
        "ko": "Internet Content & Information",
        "en": "Internet Content & Information"
      }
    }
  },
  "scores": {
    "composite": 83.4,
    "size": 92.0,
    "growth": 99.7,
    "valuation": 76.2,
    "entry": 57.5,
    "momentum": 85.5,
    "quality": 81.5,
    "threshold": 70.0,
    "version": 2
  },
  "reasoning": {
    "summary": {
      "ko": "EverQuote  Inc.(EVER)는 v2 복합 점수 83.4로 임계 70.0를 상회했습니다. 소형·가치·현금·진입 타이밍이 균형을 이룹니다.",
      "en": "EverQuote, Inc. (EVER) cleared the 70.0 threshold with v2 composite 83.4; size, value, cash, and entry align."
    },
    "growth": {
      "ko": "매출 24.6% / 이익 35.9% (혼합 29.69%) — 지속 가능 성장 점수 99.7.",
      "en": "Revenue 24.6% / earnings 35.9% (blended 29.69%) — sustainable growth score 99.7."
    },
    "valuation": {
      "ko": "PER 8.11, PEG None, FCF수익률 7.16%, PBR 3.42 — 밸류 점수 76.2.",
      "en": "P/E 8.11, PEG None, FCF yield 7.16%, P/B 3.42 — valuation score 76.2."
    },
    "momentum": {
      "ko": "6개월 수익률 53.39% — 보조 모멘텀 점수 85.5.",
      "en": "6M return 53.39% — auxiliary momentum score 85.5."
    },
    "quality": {
      "ko": "ROE 53.61%, ROA 17.83%, FCF/순이익 0.55 — 품질 점수 81.5.",
      "en": "ROE 53.61%, ROA 17.83%, FCF/net income 0.55 — quality score 81.5."
    },
    "risks": [
      {
        "ko": "실적 가이던스 하향 시 성장 프리미엄 축소 가능",
        "en": "Growth premium may compress on guidance cuts"
      },
      {
        "ko": "글로벌 금리·유동성 변화에 따른 밸류에이션 리레이팅",
        "en": "Valuation re-rating risk from rates and liquidity"
      },
      {
        "ko": "5년 10배는 목표 시나리오이며 달성을 보장하지 않음",
        "en": "10x in five years is a scenario, not a guarantee"
      }
    ],
    "size": {
      "ko": "시가총액 877822208 기준 규모 점수 92.0.",
      "en": "Market cap 877822208 — size score 92.0."
    },
    "entry": {
      "ko": "12개월 가격대 78.24%, 52주 고점 대비 -10.62% — 진입 점수 57.5.",
      "en": "12M price range 78.24%, -10.62% from 52W high — entry score 57.5."
    }
  },
  "meta": {
    "generatedAt": "2026-09-08T09:12:46+09:00",
    "candidatesScreened": 6316,
    "excludedRecent": 28,
    "skippedMarketCap": 1910,
    "skippedRedFlags": 988,
    "noData": 119,
    "errors": 19
  },
  "topCandidates": [
    {
      "rank": 1,
      "symbol": "EVER",
      "name": {
        "ko": "EverQuote  Inc.",
        "en": "EverQuote, Inc."
      },
      "exchange": "NASDAQ",
      "currency": "USD",
      "scores": {
        "composite": 83.4,
        "size": 92.0,
        "growth": 99.7,
        "valuation": 76.2,
        "entry": 57.5,
        "momentum": 85.5,
        "quality": 81.5,
        "version": 2
      }
    },
    {
      "rank": 2,
      "symbol": "UFCS",
      "name": {
        "ko": "United Fire Group Inc",
        "en": "United Fire Group, Inc."
      },
      "exchange": "NASDAQ",
      "currency": "USD",
      "scores": {
        "composite": 80.8,
        "size": 100.0,
        "growth": 99.7,
        "valuation": 84.3,
        "entry": 36.5,
        "momentum": 85.3,
        "quality": 62.9,
        "version": 2
      }
    },
    {
      "rank": 3,
      "symbol": "YB",
      "name": {
        "ko": "Yuanbao Inc ADR",
        "en": "Yuanbao Inc."
      },
      "exchange": "NASDAQ",
      "currency": "USD",
      "scores": {
        "composite": 80.4,
        "size": 100.0,
        "growth": 99.4,
        "valuation": 67.7,
        "entry": 59.0,
        "momentum": 45.1,
        "quality": 91.1,
        "version": 2
      }
    },
    {
      "rank": 4,
      "symbol": "EPAC",
      "name": {
        "ko": "Enerpac Tool Group Corp.",
        "en": "Enerpac Tool Group Corp."
      },
      "exchange": "NYSE",
      "currency": "USD",
      "scores": {
        "composite": 79.7,
        "size": 100.0,
        "growth": 92.1,
        "valuation": 72.0,
        "entry": 75.0,
        "momentum": 58.2,
        "quality": 74.8,
        "version": 2
      }
    },
    {
      "rank": 5,
      "symbol": "GLAD",
      "name": {
        "ko": "Gladstone Capital Corp",
        "en": "Gladstone Capital Corporation"
      },
      "exchange": "NASDAQ",
      "currency": "USD",
      "scores": {
        "composite": 79.5,
        "size": 100.0,
        "growth": 91.8,
        "valuation": 77.2,
        "entry": 75.0,
        "momentum": 67.0,
        "quality": 63.3,
        "version": 2
      }
    }
  ]
}
