{
  "date": "2026-08-04",
  "market": "US",
  "status": "pick",
  "stock": {
    "symbol": "UFCS",
    "name": {
      "ko": "United Fire Group Inc",
      "en": "United Fire Group, Inc."
    },
    "exchange": "NASDAQ",
    "currency": "USD",
    "profile": {
      "overview": {
        "ko": "United Fire Group Inc는 Financial Services 분야 Insurance - Property & Casualty 기업입니다.",
        "en": "United Fire Group, Inc., together with its subsidiaries, engages in writing property and casualty insurance in the United States."
      },
      "sector": {
        "ko": "Financial Services",
        "en": "Financial Services"
      },
      "industry": {
        "ko": "Insurance - Property & Casualty",
        "en": "Insurance - Property & Casualty"
      }
    }
  },
  "scores": {
    "composite": 78.5,
    "size": 100.0,
    "growth": 91.4,
    "valuation": 84.3,
    "entry": 36.5,
    "momentum": 80.4,
    "quality": 62.0,
    "threshold": 70.0,
    "version": 2
  },
  "reasoning": {
    "summary": {
      "ko": "United Fire Group Inc(UFCS)는 v2 복합 점수 78.5로 임계 70.0를 상회했습니다. 소형·가치·현금·진입 타이밍이 균형을 이룹니다.",
      "en": "United Fire Group, Inc. (UFCS) cleared the 70.0 threshold with v2 composite 78.5; size, value, cash, and entry align."
    },
    "growth": {
      "ko": "매출 11.6% / 이익 71.6% (혼합 38.6%) — 지속 가능 성장 점수 91.4.",
      "en": "Revenue 11.6% / earnings 71.6% (blended 38.6%) — sustainable growth score 91.4."
    },
    "valuation": {
      "ko": "PER 10.5, PEG 1.41, FCF수익률 20.04%, PBR 1.41 — 밸류 점수 84.3.",
      "en": "P/E 10.5, PEG 1.41, FCF yield 20.04%, P/B 1.41 — valuation score 84.3."
    },
    "momentum": {
      "ko": "6개월 수익률 43.64% — 보조 모멘텀 점수 80.4.",
      "en": "6M return 43.64% — auxiliary momentum score 80.4."
    },
    "quality": {
      "ko": "ROE 14.77%, ROA 2.96%, FCF/순이익 2.05 — 품질 점수 62.0.",
      "en": "ROE 14.77%, ROA 2.96%, FCF/net income 2.05 — quality score 62.0."
    },
    "risks": [
      {
        "ko": "실적 가이던스 하향 시 성장 프리미엄 축소 가능",
        "en": "Growth premium may compress on guidance cuts"
      },
      {
        "ko": "글로벌 금리·유동성 변화에 따른 밸류에이션 리레이팅",
        "en": "Valuation re-rating risk from rates and liquidity"
      },
      {
        "ko": "5년 10배는 목표 시나리오이며 달성을 보장하지 않음",
        "en": "10x in five years is a scenario, not a guarantee"
      }
    ],
    "size": {
      "ko": "시가총액 1336429696 기준 규모 점수 100.0.",
      "en": "Market cap 1336429696 — size score 100.0."
    },
    "entry": {
      "ko": "12개월 가격대 93.34%, 52주 고점 대비 -3.41% — 진입 점수 36.5.",
      "en": "12M price range 93.34%, -3.41% from 52W high — entry score 36.5."
    }
  },
  "meta": {
    "generatedAt": "2026-08-04T08:01:54+09:00",
    "candidatesScreened": 6304,
    "excludedRecent": 29,
    "skippedMarketCap": 1864,
    "skippedRedFlags": 1003,
    "noData": 108,
    "errors": 0
  }
}
