{
  "date": "2026-10-13",
  "market": "KR",
  "status": "pick",
  "stock": {
    "symbol": "119850.KQ",
    "name": {
      "ko": "지엔씨에너지",
      "en": "GnCenergy Co., Ltd"
    },
    "exchange": "KOSDAQ",
    "currency": "KRW",
    "profile": {
      "overview": {
        "ko": "지엔씨에너지는 Industrials 분야 Specialty Industrial Machinery 기업입니다.",
        "en": "GnCenergy Co., Ltd engages in the manufacture and sale of power generators in Korea. The company offers power generators, including diesel power generators, gas power generators, and gas turbine generators. It is also involved in the biogas power generation activities."
      },
      "sector": {
        "ko": "Industrials",
        "en": "Industrials"
      },
      "industry": {
        "ko": "Specialty Industrial Machinery",
        "en": "Specialty Industrial Machinery"
      }
    }
  },
  "scores": {
    "composite": 76.8,
    "size": 100.0,
    "growth": 91.3,
    "valuation": 64.7,
    "entry": 66.0,
    "momentum": 76.5,
    "quality": 65.8,
    "threshold": 70.0,
    "version": 2
  },
  "reasoning": {
    "summary": {
      "ko": "지엔씨에너지(119850.KQ)는 v2 복합 점수 76.8로 임계 70.0를 상회했습니다. 소형·가치·현금·진입 타이밍이 균형을 이룹니다.",
      "en": "GnCenergy Co., Ltd (119850.KQ) cleared the 70.0 threshold with v2 composite 76.8; size, value, cash, and entry align."
    },
    "growth": {
      "ko": "매출 9.3% / 이익 35.9% (혼합 21.27%) — 지속 가능 성장 점수 91.3.",
      "en": "Revenue 9.3% / earnings 35.9% (blended 21.27%) — sustainable growth score 91.3."
    },
    "valuation": {
      "ko": "PER 10.54, PEG 데이터 없음, FCF수익률 3.35%, PBR 데이터 없음 — 밸류 점수 64.7.",
      "en": "P/E 10.54, PEG No data, FCF yield 3.35%, P/B No data — valuation score 64.7."
    },
    "momentum": {
      "ko": "6개월 수익률 36.07% — 보조 모멘텀 점수 76.5.",
      "en": "6M return 36.07% — auxiliary momentum score 76.5."
    },
    "quality": {
      "ko": "ROE 20.23%, ROA 6.88%, FCF/순이익 0.51 — 품질 점수 65.8.",
      "en": "ROE 20.23%, ROA 6.88%, FCF/net income 0.51 — quality score 65.8."
    },
    "risks": [
      {
        "ko": "실적 가이던스 하향 시 성장 프리미엄 축소 가능",
        "en": "Growth premium may compress on guidance cuts"
      },
      {
        "ko": "글로벌 금리·유동성 변화에 따른 밸류에이션 리레이팅",
        "en": "Valuation re-rating risk from rates and liquidity"
      },
      {
        "ko": "5년 10배는 목표 시나리오이며 달성을 보장하지 않음",
        "en": "10x in five years is a scenario, not a guarantee"
      }
    ],
    "size": {
      "ko": "시가총액 670973755392 기준 규모 점수 100.0.",
      "en": "Market cap 670973755392 — size score 100.0."
    },
    "entry": {
      "ko": "12개월 가격대 59.59%, 52주 고점 대비 -27.45% — 진입 점수 66.0.",
      "en": "12M price range 59.59%, -27.45% from 52W high — entry score 66.0."
    }
  },
  "meta": {
    "generatedAt": "2026-10-13T11:53:30+09:00",
    "candidatesScreened": 2746,
    "excludedRecent": 29,
    "skippedMarketCap": 0,
    "skippedRedFlags": 585,
    "noData": 5,
    "errors": 2
  },
  "topCandidates": [
    {
      "rank": 1,
      "symbol": "119850.KQ",
      "name": {
        "ko": "지엔씨에너지",
        "en": "GnCenergy Co., Ltd"
      },
      "exchange": "KOSDAQ",
      "currency": "KRW",
      "scores": {
        "composite": 76.8,
        "size": 100.0,
        "growth": 91.3,
        "valuation": 64.7,
        "entry": 66.0,
        "momentum": 76.5,
        "quality": 65.8,
        "version": 2
      },
      "riskClassification": {
        "model": "jev-1.13.0",
        "sdkVersion": "0.7.2",
        "inputAt": "2026-10-13T02:53:30+00:00",
        "fallback": true,
        "fallbackReason": "missing_api_key"
      },
      "moatClassification": {
        "model": "jev-1.13.0",
        "sdkVersion": "0.7.2",
        "inputAt": "2026-10-13T02:53:30+00:00",
        "fallback": true,
        "fallbackReason": "missing_api_key"
      },
      "megatrendClassification": {
        "model": "jev-1.13.0",
        "sdkVersion": "0.7.2",
        "inputAt": "2026-10-13T02:53:30+00:00",
        "fallback": true,
        "fallbackReason": "missing_api_key"
      }
    },
    {
      "rank": 2,
      "symbol": "284740.KS",
      "name": {
        "ko": "쿠쿠홈시스",
        "en": "CUCKOO Homesys Co., Ltd"
      },
      "exchange": "KOSPI",
      "currency": "KRW",
      "scores": {
        "composite": 76.8,
        "size": 100.0,
        "growth": 99.2,
        "valuation": 65.8,
        "entry": 75.0,
        "momentum": 60.6,
        "quality": 59.9,
        "version": 2
      },
      "riskClassification": {
        "model": "jev-1.13.0",
        "sdkVersion": "0.7.2",
        "inputAt": "2026-10-13T02:53:30+00:00",
        "fallback": true,
        "fallbackReason": "missing_api_key"
      },
      "moatClassification": {
        "model": "jev-1.13.0",
        "sdkVersion": "0.7.2",
        "inputAt": "2026-10-13T02:53:30+00:00",
        "fallback": true,
        "fallbackReason": "missing_api_key"
      },
      "megatrendClassification": {
        "model": "jev-1.13.0",
        "sdkVersion": "0.7.2",
        "inputAt": "2026-10-13T02:53:30+00:00",
        "fallback": true,
        "fallbackReason": "missing_api_key"
      }
    },
    {
      "rank": 3,
      "symbol": "950190.KQ",
      "name": {
        "ko": "고스트스튜디오",
        "en": "Ghost Studio Co., Ltd."
      },
      "exchange": "KOSDAQ",
      "currency": "KRW",
      "scores": {
        "composite": 76.8,
        "size": 100.0,
        "growth": 96.5,
        "valuation": 65.8,
        "entry": 75.0,
        "momentum": 66.7,
        "quality": 59.4,
        "version": 2
      },
      "riskClassification": {
        "model": "jev-1.13.0",
        "sdkVersion": "0.7.2",
        "inputAt": "2026-10-13T02:53:30+00:00",
        "fallback": true,
        "fallbackReason": "missing_api_key"
      },
      "moatClassification": {
        "model": "jev-1.13.0",
        "sdkVersion": "0.7.2",
        "inputAt": "2026-10-13T02:53:30+00:00",
        "fallback": true,
        "fallbackReason": "missing_api_key"
      },
      "megatrendClassification": {
        "model": "jev-1.13.0",
        "sdkVersion": "0.7.2",
        "inputAt": "2026-10-13T02:53:30+00:00",
        "fallback": true,
        "fallbackReason": "missing_api_key"
      }
    },
    {
      "rank": 4,
      "symbol": "090080.KS",
      "name": {
        "ko": "평화산업",
        "en": "Pyung Hwa Industrial Co., Ltd."
      },
      "exchange": "KOSPI",
      "currency": "KRW",
      "scores": {
        "composite": 76.5,
        "size": 100.0,
        "growth": 82.8,
        "valuation": 65.8,
        "entry": 75.0,
        "momentum": 60.0,
        "quality": 74.9,
        "version": 2
      },
      "riskClassification": {
        "model": "jev-1.13.0",
        "sdkVersion": "0.7.2",
        "inputAt": "2026-10-13T02:53:30+00:00",
        "fallback": true,
        "fallbackReason": "missing_api_key"
      },
      "moatClassification": {
        "model": "jev-1.13.0",
        "sdkVersion": "0.7.2",
        "inputAt": "2026-10-13T02:53:30+00:00",
        "fallback": true,
        "fallbackReason": "missing_api_key"
      },
      "megatrendClassification": {
        "model": "jev-1.13.0",
        "sdkVersion": "0.7.2",
        "inputAt": "2026-10-13T02:53:30+00:00",
        "fallback": true,
        "fallbackReason": "missing_api_key"
      }
    },
    {
      "rank": 5,
      "symbol": "068930.KQ",
      "name": {
        "ko": "디지털대성",
        "en": "Digital Daesung Co., Ltd."
      },
      "exchange": "KOSDAQ",
      "currency": "KRW",
      "scores": {
        "composite": 75.9,
        "size": 100.0,
        "growth": 75.2,
        "valuation": 73.5,
        "entry": 57.5,
        "momentum": 64.9,
        "quality": 76.2,
        "version": 2
      },
      "riskClassification": {
        "model": "jev-1.13.0",
        "sdkVersion": "0.7.2",
        "inputAt": "2026-10-13T02:53:30+00:00",
        "fallback": true,
        "fallbackReason": "missing_api_key"
      },
      "moatClassification": {
        "model": "jev-1.13.0",
        "sdkVersion": "0.7.2",
        "inputAt": "2026-10-13T02:53:30+00:00",
        "fallback": true,
        "fallbackReason": "missing_api_key"
      },
      "megatrendClassification": {
        "model": "jev-1.13.0",
        "sdkVersion": "0.7.2",
        "inputAt": "2026-10-13T02:53:30+00:00",
        "fallback": true,
        "fallbackReason": "missing_api_key"
      }
    }
  ]
}
