{
  "date": "2026-08-11",
  "market": "KR",
  "status": "pick",
  "stock": {
    "symbol": "204610.KQ",
    "name": {
      "ko": "티쓰리",
      "en": "T3 Entertainment Inc."
    },
    "exchange": "KOSDAQ",
    "currency": "KRW",
    "profile": {
      "overview": {
        "ko": "티쓰리는 Communication Services 분야 Electronic Gaming & Multimedia 기업입니다.",
        "en": "T3 Entertainment Inc. develops games for PCs, mobiles, and consoles in South Korea and internationally. T3 Entertainment Inc."
      },
      "sector": {
        "ko": "Communication Services",
        "en": "Communication Services"
      },
      "industry": {
        "ko": "Electronic Gaming & Multimedia",
        "en": "Electronic Gaming & Multimedia"
      }
    }
  },
  "scores": {
    "composite": 80.5,
    "size": 100.0,
    "growth": 93.7,
    "valuation": 70.0,
    "entry": 47.0,
    "momentum": 100.0,
    "quality": 72.7,
    "threshold": 70.0,
    "version": 2
  },
  "reasoning": {
    "summary": {
      "ko": "티쓰리(204610.KQ)는 v2 복합 점수 80.5로 임계 70.0를 상회했습니다. 소형·가치·현금·진입 타이밍이 균형을 이룹니다.",
      "en": "T3 Entertainment Inc. (204610.KQ) cleared the 70.0 threshold with v2 composite 80.5; size, value, cash, and entry align."
    },
    "growth": {
      "ko": "매출 37.8% / 이익 34.4% (혼합 36.27%) — 지속 가능 성장 점수 93.7.",
      "en": "Revenue 37.8% / earnings 34.4% (blended 36.27%) — sustainable growth score 93.7."
    },
    "valuation": {
      "ko": "PER 11.26, PEG None, FCF수익률 7.97%, PBR None — 밸류 점수 70.0.",
      "en": "P/E 11.26, PEG None, FCF yield 7.97%, P/B None — valuation score 70.0."
    },
    "momentum": {
      "ko": "6개월 수익률 83.85% — 보조 모멘텀 점수 100.0.",
      "en": "6M return 83.85% — auxiliary momentum score 100.0."
    },
    "quality": {
      "ko": "ROE 21.73%, ROA 9.8%, FCF/순이익 0.76 — 품질 점수 72.7.",
      "en": "ROE 21.73%, ROA 9.8%, FCF/net income 0.76 — quality score 72.7."
    },
    "risks": [
      {
        "ko": "실적 가이던스 하향 시 성장 프리미엄 축소 가능",
        "en": "Growth premium may compress on guidance cuts"
      },
      {
        "ko": "글로벌 금리·유동성 변화에 따른 밸류에이션 리레이팅",
        "en": "Valuation re-rating risk from rates and liquidity"
      },
      {
        "ko": "5년 10배는 목표 시나리오이며 달성을 보장하지 않음",
        "en": "10x in five years is a scenario, not a guarantee"
      }
    ],
    "size": {
      "ko": "시가총액 170458742784 기준 규모 점수 100.0.",
      "en": "Market cap 170458742784 — size score 100.0."
    },
    "entry": {
      "ko": "12개월 가격대 88.91%, 52주 고점 대비 -6.19% — 진입 점수 47.0.",
      "en": "12M price range 88.91%, -6.19% from 52W high — entry score 47.0."
    }
  },
  "meta": {
    "generatedAt": "2026-08-11T06:58:40+09:00",
    "candidatesScreened": 1903,
    "excludedRecent": 28,
    "skippedMarketCap": 845,
    "skippedRedFlags": 313,
    "noData": 0,
    "errors": 0
  }
}
