{
  "date": "2026-08-15",
  "market": "KR",
  "status": "pick",
  "stock": {
    "symbol": "001060.KS",
    "name": {
      "ko": "JW중외제약",
      "en": "JW Pharmaceutical Corporation"
    },
    "exchange": "KOSPI",
    "currency": "KRW",
    "profile": {
      "overview": {
        "ko": "JW중외제약는 Healthcare 분야 Drug Manufacturers - Specialty & Generic 기업입니다.",
        "en": "JW Pharmaceutical Corporation manufactures and sells medicines and medical supplies in Japan and internationally. It offers products in the areas of cancer, immunological disease, cardiovascular system and metabolic diseases, regenerative medicine, eye diseases , and pancreatic cancer."
      },
      "sector": {
        "ko": "Healthcare",
        "en": "Healthcare"
      },
      "industry": {
        "ko": "Drug Manufacturers - Specialty & Generic",
        "en": "Drug Manufacturers - Specialty & Generic"
      }
    }
  },
  "scores": {
    "composite": 80.7,
    "size": 100.0,
    "growth": 99.0,
    "valuation": 65.8,
    "entry": 59.0,
    "momentum": 100.0,
    "quality": 68.0,
    "threshold": 70.0,
    "version": 2
  },
  "reasoning": {
    "summary": {
      "ko": "JW중외제약(001060.KS)는 v2 복합 점수 80.7로 임계 70.0를 상회했습니다. 소형·가치·현금·진입 타이밍이 균형을 이룹니다.",
      "en": "JW Pharmaceutical Corporation (001060.KS) cleared the 70.0 threshold with v2 composite 80.7; size, value, cash, and entry align."
    },
    "growth": {
      "ko": "매출 7.9% / 이익 59.3% (혼합 31.03%) — 지속 가능 성장 점수 99.0.",
      "en": "Revenue 7.9% / earnings 59.3% (blended 31.03%) — sustainable growth score 99.0."
    },
    "valuation": {
      "ko": "PER None, PEG None, FCF수익률 9.16%, PBR None — 밸류 점수 65.8.",
      "en": "P/E None, PEG None, FCF yield 9.16%, P/B None — valuation score 65.8."
    },
    "momentum": {
      "ko": "6개월 수익률 nan% — 보조 모멘텀 점수 100.0.",
      "en": "6M return nan% — auxiliary momentum score 100.0."
    },
    "quality": {
      "ko": "ROE 20.07%, ROA 10.08%, FCF/순이익 0.89 — 품질 점수 68.0.",
      "en": "ROE 20.07%, ROA 10.08%, FCF/net income 0.89 — quality score 68.0."
    },
    "risks": [
      {
        "ko": "실적 가이던스 하향 시 성장 프리미엄 축소 가능",
        "en": "Growth premium may compress on guidance cuts"
      },
      {
        "ko": "글로벌 금리·유동성 변화에 따른 밸류에이션 리레이팅",
        "en": "Valuation re-rating risk from rates and liquidity"
      },
      {
        "ko": "5년 10배는 목표 시나리오이며 달성을 보장하지 않음",
        "en": "10x in five years is a scenario, not a guarantee"
      }
    ],
    "size": {
      "ko": "시가총액 666252869632 기준 규모 점수 100.0.",
      "en": "Market cap 666252869632 — size score 100.0."
    },
    "entry": {
      "ko": "12개월 가격대 nan%, 52주 고점 대비 nan% — 진입 점수 59.0.",
      "en": "12M price range nan%, nan% from 52W high — entry score 59.0."
    }
  },
  "meta": {
    "generatedAt": "2026-08-15T06:42:45+09:00",
    "candidatesScreened": 1915,
    "excludedRecent": 27,
    "skippedMarketCap": 835,
    "skippedRedFlags": 317,
    "noData": 0,
    "errors": 0
  }
}
